{
  "policy.name": "Reconnaissance - Log4j Scanner Detected in User Agent (T1595)",
  "policy.type": "Log",
  "policy.tags": [
    "Default",
    "Security",
    "Reconnaissance",
    "T1595",
    "TA0043",
    "Log4j",
    "Vulnerability Scanning"
  ],
  "policy.scheduled": "no",
  "policy.context": {
    "entity.type": "event.source.type",
    "entities": [
      "Apache",
      "Nginx"
    ],
    "data.point": "message",
    "aggregator": "count",
    "operator": ">=",
    "value": 1,
    "trigger.mode": "individual",
    "evaluation.window": 5,
    "evaluation.window.unit": "minute",
    "evaluation.frequency": 5,
    "evaluation.frequency.unit": "minute",
    "policy.severity": "MAJOR",
    "policy.result.by": [
      "event.source"
    ],
    "policy.trigger.occurrences": 1,
    "policy.auto.clear.timer.seconds": 0,
    "filters": {
      "data.filter": {
        "operator": "or",
        "filter": "include",
        "groups": [
          {
            "filter": "include",
            "operator": "or",
            "conditions": [
              {
                "operand": "source",
                "operator": "in",
                "value": "apache,nginx"
              },
              {
                "operand": "@http.referer",
                "operator": "contains",
                "value": "jndi:ldap"
              },
              {
                "operand": "@http.referer",
                "operator": "contains",
                "value": "jndi:rmi"
              },
              {
                "operand": "@http.referer",
                "operator": "contains",
                "value": "jndi:dns"
              },
              {
                "operand": "@http.user_agent",
                "operator": "contains",
                "value": "jndi:ldap"
              },
              {
                "operand": "@http.user_agent",
                "operator": "contains",
                "value": "jndi:rmi"
              },
              {
                "operand": "@http.user_agent",
                "operator": "contains",
                "value": "jndi:dns"
              }
            ]
          }
        ]
      }
    }
  },
  "policy.email.notification.recipients": [],
  "policy.renotify": "yes",
  "policy.monitor.polling.failed.notification.timer.seconds": 0,
  "policy.monitor.polling.failed.notification.status": "no",
  "policy.renotification.timer.seconds": 0,
  "policy.actions": {},
  "policy.suppress.action": "no",
  "policy.archived": "no",
  "policy.creation.time": 1735188945,
  "policy.state": "no",
  "_type": "1",
  "id": 10000000000037
}