{
  "policy.name": "Privilege Escalation - Windows RottenPotato Attack Pattern (T1557)",
  "policy.type": "Log",
  "policy.tags": [
    "Default",
    "Security",
    "Privilege Escalation",
    "T1557",
    "TA0004",
    "Windows"
  ],
  "policy.scheduled": "no",
  "policy.context": {
    "entity.type": "event.source.type",
    "entities": [
      "Windows"
    ],
    "data.point": "message",
    "aggregator": "count",
    "operator": ">=",
    "value": 1,
    "trigger.mode": "individual",
    "evaluation.window": 5,
    "evaluation.window.unit": "minute",
    "evaluation.frequency": 5,
    "evaluation.frequency.unit": "minute",
    "policy.severity": "CRITICAL",
    "policy.result.by": [
      "event.source"
    ],
    "policy.trigger.occurrences": 1,
    "policy.auto.clear.timer.seconds": 0,
    "filters": {
      "data.filter": {
        "operator": "and",
        "filter": "include",
        "groups": [
          {
            "filter": "include",
            "operator": "and",
            "conditions": [
              {
                "operand": "source",
                "operator": "=",
                "value": "windows.events"
              },
              {
                "operand": "@evt.id",
                "operator": "=",
                "value": "4624"
              },
              {
                "operand": "@network.client.ip",
                "operator": "=",
                "value": "127.0.0.1"
              },
              {
                "operand": "@Event.EventData.Data.LogonType",
                "operator": "=",
                "value": "3"
              },
              {
                "operand": "@Event.EventData.Data.TargetUserName",
                "operator": "=",
                "value": "ANONYMOUS LOGON"
              }
            ]
          }
        ]
      }
    }
  },
  "policy.email.notification.recipients": [],
  "policy.renotify": "yes",
  "policy.monitor.polling.failed.notification.timer.seconds": 0,
  "policy.monitor.polling.failed.notification.status": "no",
  "policy.renotification.timer.seconds": 0,
  "policy.actions": {},
  "policy.suppress.action": "no",
  "policy.archived": "no",
  "policy.creation.time": 1735188945,
  "policy.state": "no",
  "_type": "1",
  "id": 10000000000033
}