{
  "policy.name": "Credential Access - Unusual 1Password Item Usage (T1555)",
  "policy.type": "Log",
  "policy.tags": [
    "Default",
    "Security",
    "Credential Access",
    "T1555",
    "TA0006",
    "1Password",
    "Password Manager"
  ],
  "policy.scheduled": "no",
  "policy.context": {
    "entity.type": "event.source.type",
    "entities": [
      "1Password"
    ],
    "data.point": "message",
    "aggregator": "count",
    "operator": ">=",
    "value": 1,
    "trigger.mode": "individual",
    "evaluation.window": 5,
    "evaluation.window.unit": "minute",
    "evaluation.frequency": 5,
    "evaluation.frequency.unit": "minute",
    "policy.severity": "WARNING",
    "policy.result.by": [
      "event.source"
    ],
    "policy.trigger.occurrences": 1,
    "policy.auto.clear.timer.seconds": 0,
    "filters": {
      "data.filter": {
        "operator": "and",
        "filter": "include",
        "groups": [
          {
            "filter": "include",
            "operator": "and",
            "conditions": [
              {
                "operand": "message",
                "operator": "contains",
                "value": "1Password"
              },
              {
                "operand": "message",
                "operator": "contains",
                "value": "performed action"
              }
            ]
          },
          {
            "filter": "include",
            "operator": "or",
            "conditions": [
              {
                "operand": "message",
                "operator": "contains",
                "value": "bulk_export"
              },
              {
                "operand": "message",
                "operator": "contains",
                "value": "mass_access"
              },
              {
                "operand": "message",
                "operator": "contains",
                "value": "rapid_access"
              }
            ]
          }
        ]
      }
    }
  },
  "policy.email.notification.recipients": [],
  "policy.renotify": "yes",
  "policy.monitor.polling.failed.notification.timer.seconds": 0,
  "policy.monitor.polling.failed.notification.status": "no",
  "policy.renotification.timer.seconds": 0,
  "policy.actions": {},
  "policy.suppress.action": "no",
  "policy.archived": "no",
  "policy.creation.time": 1735188945,
  "policy.state": "no",
  "_type": "1",
  "id": 10000000000039
}