{
  "policy.name": "Defense Evasion - Windows Firewall Disabled (T1562)",
  "policy.type": "Log",
  "policy.tags": [
    "Default",
    "Security",
    "Defense Evasion",
    "T1562",
    "TA0005",
    "Windows",
    "Firewall"
  ],
  "policy.scheduled": "no",
  "policy.context": {
    "entity.type": "event.source.type",
    "entities": [
      "Windows"
    ],
    "data.point": "message",
    "aggregator": "count",
    "operator": ">=",
    "value": 1,
    "trigger.mode": "individual",
    "evaluation.window": 5,
    "evaluation.window.unit": "minute",
    "evaluation.frequency": 5,
    "evaluation.frequency.unit": "minute",
    "policy.severity": "MAJOR",
    "policy.result.by": [
      "event.source"
    ],
    "policy.trigger.occurrences": 1,
    "policy.auto.clear.timer.seconds": 0,
    "filters": {
      "data.filter": {
        "operator": "and",
        "filter": "include",
        "groups": [
          {
            "filter": "include",
            "operator": "and",
            "conditions": [
              {
                "operand": "message",
                "operator": "contains",
                "value": "Microsoft-Windows-Windows Firewall With Advanced Security/Firewall"
              },
              {
                "operand": "message",
                "operator": "contains",
                "value": "Windows Firewall configuration has changed"
              }
            ]
          },
          {
            "filter": "include",
            "operator": "and",
            "conditions": [
              {
                "operand": "message",
                "operator": "contains",
                "value": "Configuration Type = Enable Firewall"
              },
              {
                "operand": "message",
                "operator": "contains",
                "value": "New Setting = No"
              }
            ]
          }
        ]
      }
    }
  },
  "policy.email.notification.recipients": [],
  "policy.renotify": "yes",
  "policy.monitor.polling.failed.notification.timer.seconds": 0,
  "policy.monitor.polling.failed.notification.status": "no",
  "policy.renotification.timer.seconds": 0,
  "policy.actions": {},
  "policy.suppress.action": "no",
  "policy.archived": "no",
  "policy.creation.time": 1735188945,
  "policy.state": "no",
  "_type": "1",
  "id": 10000000000034
}