{
  "policy.name": "Privilege Escalation - Administrative Privileges Assigned (T1098)",
  "policy.type": "Log",
  "policy.tags": [
    "Default",
    "Security",
    "Authentication",
    "T1098",
    "TA0004",
    "Windows",
    "PrivilegeEscalation"
  ],
  "policy.scheduled": "no",
  "policy.context": {
    "entity.type": "event.source.type",
    "entities": [
      "Windows"
    ],
    "data.point": "message",
    "aggregator": "count",
    "operator": ">=",
    "value": 1,
    "trigger.mode": "individual",
    "evaluation.window": 5,
    "evaluation.window.unit": "minute",
    "evaluation.frequency": 5,
    "evaluation.frequency.unit": "minute",
    "policy.severity": "MAJOR",
    "policy.result.by": [
      "event.source"
    ],
    "policy.trigger.occurrences": 1,
    "policy.auto.clear.timer.seconds": 0,
    "filters": {
      "data.filter": {
        "operator": "and",
        "filter": "include",
        "groups": [
          {
            "filter": "include",
            "operator": "and",
            "conditions": [
              {
                "operand": "message",
                "operator": "contains",
                "value": "Microsoft-Windows-Security-Auditing"
              },
              {
                "operand": "message",
                "operator": "contains",
                "value": "An attempt was made to assign the requested privileges"
              }
            ]
          },
          {
            "filter": "include",
            "operator": "or",
            "conditions": [
              {
                "operand": "message",
                "operator": "contains",
                "value": "SeDebugPrivilege"
              },
              {
                "operand": "message",
                "operator": "contains",
                "value": "SeSecurityPrivilege"
              },
              {
                "operand": "message",
                "operator": "contains",
                "value": "SeTcbPrivilege"
              }
            ]
          }
        ]
      }
    }
  },
  "policy.email.notification.recipients": [],
  "policy.renotify": "yes",
  "policy.monitor.polling.failed.notification.timer.seconds": 0,
  "policy.monitor.polling.failed.notification.status": "no",
  "policy.renotification.timer.seconds": 0,
  "policy.actions": {},
  "policy.suppress.action": "no",
  "policy.archived": "no",
  "policy.creation.time": 1735188945,
  "policy.state": "no",
  "_type": "1",
  "id": 10000000000031
}